{
  "$schema": "https://json-schema.org/draft/2020-12/schema",
  "title": "Heimdall configuration",
  "description": "Configuration file for Heimdall (.heimdall.json). Validated by heimdall init and loaded by heimdall lint/check and heimdall-lsp.",
  "type": "object",
  "properties": {
    "$schema": {
      "type": "string",
      "description": "JSON Schema URI used by editors for completion and validation."
    },
    "root": {
      "type": "boolean",
      "default": false,
      "description": "When true, stop searching parent directories for additional configs."
    },
    "suppressions": {
      "type": "boolean",
      "default": true,
      "description": "When false, // heimdall-suppress comments are ignored."
    },
    "rules": {
      "type": "object",
      "description": "Rules are disabled unless listed here. Valid values are 'off', 'warning' and 'error'.",
      "properties": {
        "cpp/no-null": {
          "enum": [
            "off",
            "warning",
            "error"
          ]
        },
        "cpp/constant-naming": {
          "enum": ["off", "warning", "error"]
        },
        "format/no-trailing-whitespace": {
          "enum": [
            "off",
            "warning",
            "error"
          ]
        },
        "format/require-final-newline": {
          "enum": [
            "off",
            "warning",
            "error"
          ]
        },
        "cpp/no-empty-catch": {
          "enum": [
            "off",
            "warning",
            "error"
          ]
        },
        "cpp/no-duplicate-include": {
          "enum": [
            "off",
            "warning",
            "error"
          ]
        },
        "cpp/modernize-using": {
          "enum": [
            "off",
            "warning",
            "error"
          ]
        },
        "cpp/modernize-override": {
          "enum": [
            "off",
            "warning",
            "error"
          ]
        },
        "cpp/modernize-nullptr": {
          "enum": [
            "off",
            "warning",
            "error"
          ]
        },
        "cpp/no-zero-as-null": {
          "enum": [
            "off",
            "warning",
            "error"
          ]
        },
        "cpp/modernize-auto": {
          "enum": [
            "off",
            "warning",
            "error"
          ]
        },
        "cpp/no-implicit-bool-conversion": {
          "enum": [
            "off",
            "warning",
            "error"
          ]
        },
        "cpp/modernize-range-loop": {
          "enum": [
            "off",
            "warning",
            "error"
          ]
        },
        "cpp/modernize-loop-convert": {
          "enum": [
            "off",
            "warning",
            "error"
          ]
        },
        "cpp/include-what-you-use": {
          "enum": [
            "off",
            "warning",
            "error"
          ]
        },
        "cpp/modernize-final": {
          "enum": [
            "off",
            "warning",
            "error"
          ]
        },
        "cpp/modernize-const": {
          "enum": [
            "off",
            "warning",
            "error"
          ]
        },
        "cpp/modernize-constexpr": {
          "enum": [
            "off",
            "warning",
            "error"
          ]
        },
        "cpp/modernize-emplace": {
          "enum": [
            "off",
            "warning",
            "error"
          ]
        },
        "cpp/modernize-make-unique": {
          "enum": [
            "off",
            "warning",
            "error"
          ]
        },
        "cpp/modernize-make-shared": {
          "enum": [
            "off",
            "warning",
            "error"
          ]
        },
        "cpp/modernize-smart-ptr": {
          "enum": [
            "off",
            "warning",
            "error"
          ]
        },
        "cpp/no-new-delete": {
          "enum": [
            "off",
            "warning",
            "error"
          ]
        },
        "cpp/modernize-span": {
          "enum": [
            "off",
            "warning",
            "error"
          ]
        },
        "cpp/modernize-string-view": {
          "enum": [
            "off",
            "warning",
            "error"
          ]
        },
        "cpp/modernize-algorithms": {
          "enum": [
            "off",
            "warning",
            "error"
          ]
        },
        "cpp/modernize-structured-bindings": {
          "enum": [
            "off",
            "warning",
            "error"
          ]
        },
        "cpp/modernize-attributes": {
          "enum": [
            "off",
            "warning",
            "error"
          ]
        },
        "cpp/modernize-consteval-constexpr": {
          "enum": [
            "off",
            "warning",
            "error"
          ]
        },
        "api/virtual-destructor": {
          "enum": [
            "off",
            "warning",
            "error"
          ]
        },
        "api/missing-nodiscard": {
          "enum": [
            "off",
            "warning",
            "error"
          ]
        },
        "api/pass-by-value": {
          "enum": [
            "off",
            "warning",
            "error"
          ]
        },
        "api/pass-by-const-reference": {
          "enum": [
            "off",
            "warning",
            "error"
          ]
        },
        "api/const-correctness": {
          "enum": [
            "off",
            "warning",
            "error"
          ]
        },
        "api/unsafe-downcast": {
          "enum": [
            "off",
            "warning",
            "error"
          ]
        },
        "api/slicing": {
          "enum": [
            "off",
            "warning",
            "error"
          ]
        },
        "api/implicit-conversion": {
          "enum": [
            "off",
            "warning",
            "error"
          ]
        },
        "api/explicit-constructor": {
          "enum": [
            "off",
            "warning",
            "error"
          ]
        },
        "api/overload-hiding": {
          "enum": [
            "off",
            "warning",
            "error"
          ]
        },
        "api/virtual-call-in-constructor": {
          "enum": [
            "off",
            "warning",
            "error"
          ]
        },
        "doc/require-comment": {
          "enum": [
            "off",
            "warning",
            "error"
          ],
          "description": "Opt-in. Public classes, enums and functions need a Doxygen comment. See 'doc.scope'."
        },
        "doc/doxygen-style": {
          "enum": [
            "off",
            "warning",
            "error"
          ],
          "description": "Opt-in. Doxygen comments need @brief, @param, @tparam, @return and @throws, one-sentence briefs and Javadoc style. See 'doc.scope'."
        },
        "cpp/no-integer-to-pointer": {
          "enum": [
            "off",
            "warning",
            "error"
          ]
        },
        "cpp/designated-init-order": {
          "enum": [
            "off",
            "warning",
            "error"
          ]
        },
        "cpp/no-unused-include": {
          "enum": [
            "off",
            "warning",
            "error"
          ]
        },
        "cpp/prefer-forward-declaration": {
          "enum": [
            "off",
            "warning",
            "error"
          ]
        },
        "cpp/no-circular-include": {
          "enum": [
            "off",
            "warning",
            "error"
          ]
        },
        "cpp/sort-includes": {
          "enum": [
            "off",
            "warning",
            "error"
          ]
        },
        "cpp/no-todo": {
          "enum": [
            "off",
            "warning",
            "error"
          ]
        },
        "cpp/no-magic-numbers": {
          "enum": [
            "off",
            "warning",
            "error"
          ]
        },
        "cpp/call-argument-count": {
          "enum": ["off", "warning", "error"],
          "description": "Function call with an incorrect number of arguments."
        },
        "cpp/call-argument-type": {
          "enum": ["off", "warning", "error"],
          "description": "Function argument without a valid implicit conversion."
        },
        "cpp/template-substitution": {
          "enum": ["off", "warning", "error"],
          "description": "Proven template instantiation failure or no viable local overload."
        },
        "cpp/dot-on-pointer": {
          "enum": ["off", "warning", "error"],
          "description": "Member accessed with '.' on a pointer instead of '->'."
        },
        "cpp/access-control": {
          "enum": ["off", "warning", "error"],
          "description": "Member access that is not permitted by its access level."
        },
        "cpp/conflicting-declaration": {
          "enum": ["off", "warning", "error"],
          "description": "Variable redeclared with an incompatible declaration."
        },
        "cpp/undeclared-type": {
          "enum": ["off", "warning", "error"],
          "description": "Unknown type name in a declaration."
        },
        "cpp/unreachable-code": {
          "enum": ["off", "warning", "error"],
          "description": "Statement that cannot be reached."
        },
        "cpp/missing-return": {
          "enum": ["off", "warning", "error"],
          "description": "Non-void function that can fall off the end."
        },
        "cpp/return-type": {
          "enum": ["off", "warning", "error"],
          "description": "Return incompatible with the function return type."
        },
        "cpp/concept-recursive": {
          "enum": ["off", "warning", "error"],
          "description": "Concept that refers to itself in its own definition."
        },
        "cpp/concept-constrained": {
          "enum": ["off", "warning", "error"],
          "description": "Concept definition with a requires-clause or constrained parameters."
        },
        "cpp/concept-placement": {
          "enum": ["off", "warning", "error"],
          "description": "Concept defined outside namespace scope."
        },
        "cpp/concept-specialization": {
          "enum": ["off", "warning", "error"],
          "description": "Concept that is explicitly specialized or instantiated."
        },
        "cpp/requires-form": {
          "enum": ["off", "warning", "error"],
          "description": "Call with template arguments in a requires-clause without parentheses."
        },
        "cpp/requires-parameter": {
          "enum": ["off", "warning", "error"],
          "description": "Requires-expression parameter with a default or trailing ellipsis."
        },
        "cpp/concept-arity": {
          "enum": ["off", "warning", "error"],
          "description": "Concept-id used with the wrong number of arguments."
        },
        "cpp/requires-unknown-type": {
          "enum": ["off", "warning", "error"],
          "description": "Type requirement naming an unknown type outside templates."
        },
        "cpp/concept-redeclaration": {
          "enum": ["off", "warning", "error"],
          "description": "Constrained redeclaration with a different constraint spelling."
        },
        "cpp/const-member-modification": {
          "enum": ["off", "warning", "error"],
          "description": "Assignment modifying a member through a const member function."
        }
      },
      "additionalProperties": false
    },
    "macros": {
      "type": "object",
      "description": "Bounds of the macro environment built for each translation unit (macro-aware parsing, highlighting, navigation and refactoring).",
      "properties": {
        "max-include-depth": {
          "type": "integer",
          "minimum": 1,
          "maximum": 1000000,
          "default": 200,
          "description": "Deepest #include nesting followed. GCC and Clang stop at 200."
        },
        "max-macros": {
          "type": "integer",
          "minimum": 1,
          "maximum": 1000000,
          "default": 65536,
          "description": "Distinct macro names defined across one translation unit before headers stop being entered. The C++ standard asks implementations to support 65536."
        }
      },
      "additionalProperties": false
    },
    "naming": {
      "type": "object",
      "description": "Naming conventions checked by naming rules.",
      "properties": {
        "constants": {
          "enum": ["k-prefix", "screaming-snake-case"],
          "default": "k-prefix",
          "description": "Required casing for const/constexpr variables and #define names. Enable cpp/constant-naming in rules."
        }
      },
      "additionalProperties": false
    },
    "include-order": {
      "type": "object",
      "description": "Group order used by cpp/sort-includes. The rule only runs when enabled in 'rules'.",
      "properties": {
        "groups": {
          "type": "array",
          "description": "Ordered include groups. Must list both 'angle' and 'quote'.",
          "items": {
            "enum": [
              "angle",
              "quote"
            ]
          },
          "minItems": 2,
          "maxItems": 2,
          "uniqueItems": true
        },
        "case-insensitive": {
          "type": "boolean",
          "default": true
        }
      },
      "required": [
        "groups"
      ],
      "additionalProperties": false
    },
    "doc": {
      "type": "object",
      "description": "Options of the doc/* rules.",
      "properties": {
        "scope": {
          "enum": [
            "public",
            "private",
            "all"
          ],
          "default": "public",
          "description": "Which declarations are checked: 'public' (public and protected members, namespace-scope entities with external linkage), 'private' (private members, static and anonymous-namespace entities) or 'all'."
        }
      },
      "additionalProperties": false
    },
    "format": {
      "type": "object",
      "description": "Formatter settings. CLI alignment flags override the corresponding values.",
      "properties": {
        "indent-width": {
          "type": "integer",
          "minimum": 0,
          "default": 4,
          "description": "Number of spaces per indentation level; zero is allowed."
        },
        "use-tabs": {
          "type": "boolean",
          "default": false,
          "description": "Indent with tabs instead of spaces."
        },
        "max-empty-lines": {
          "type": "integer",
          "minimum": 0,
          "default": 1,
          "description": "Maximum consecutive empty lines retained."
        },
        "column-limit": {
          "type": "integer",
          "minimum": 0,
          "default": 100,
          "description": "Maximum line width for formatter wrapping; zero disables wrapping."
        },
        "sort-includes": {
          "type": "boolean",
          "default": false,
          "description": "Sort contiguous include directives."
        },
        "blank-line-after-control-block": {
          "type": "boolean",
          "default": true,
          "description": "Insert a blank line after control-flow blocks."
        },
        "blank-line-after-type-definition": {
          "type": "boolean",
          "default": true,
          "description": "Insert a blank line after type definitions."
        },
        "space-before-inheritance-colon": {
          "type": "boolean",
          "default": true,
          "description": "Put a space before inheritance and enum underlying-type colons."
        },
        "align-trailing-comments": {
          "type": "boolean",
          "default": true,
          "description": "Align adjacent trailing line comments."
        },
        "align-consecutive-macros": {
          "type": "boolean",
          "default": false,
          "description": "Align replacement lists of adjacent single-line #define directives."
        },
        "align-consecutive-assignments": {
          "type": "boolean",
          "default": false,
          "description": "Align top-level = operators in consecutive single-line statements."
        },
        "space-after-c-style-cast": {
          "type": "boolean",
          "default": true,
          "description": "Separate a C-style cast from its operand."
        },
        "space-after-logical-not": {
          "type": "boolean",
          "default": false,
          "description": "Insert a space after the logical-not operator."
        },
        "space-before-cpp11-braced-list": {
          "type": "boolean",
          "default": true,
          "description": "Separate a type or name from its braced initializer."
        },
        "pointer-alignment": {
          "enum": [
            "left",
            "right"
          ],
          "default": "left",
          "description": "Attachment of declarator `*`: 'left' formats `int* x`, 'right' formats `int *x`."
        },
        "reference-alignment": {
          "enum": [
            "left",
            "right"
          ],
          "default": "left",
          "description": "Attachment of declarator `&`/`&&`: 'left' formats `int& x`, 'right' formats `int &x`."
        },
        "blank-line-between-methods": {
          "type": "boolean",
          "default": true,
          "description": "Separate function/method declarations and definitions with blank lines. In records, also separate fields, methods and access sections; consecutive fields stay grouped. Documentation stays attached."
        }
      },
      "additionalProperties": false
    }
  },
  "additionalProperties": false
}
