{
  "$schema": "../schemas/heimdall.schema.json",
  "root": true,
  "suppressions": true,
  "rules": {
    "cpp/no-magic-numbers": "off",
    "cpp/no-null": "warning",
    "format/no-trailing-whitespace": "warning",
    "format/require-final-newline": "warning",
    "cpp/no-empty-catch": "warning",
    "cpp/no-duplicate-include": "warning",
    "cpp/modernize-using": "warning",
    "doc/require-comment": "off",
    "doc/doxygen-style": "off"
  },
  "format": {
    "pointer-alignment": "left",
    "reference-alignment": "left"
  },
  "include-order": {
    "groups": [
      "angle",
      "quote"
    ],
    "case-insensitive": true
  }
}